"DESCRIPTION","DURATION IN MS","NAME","PARENT SUITE","START TIME","STATUS","STOP TIME","SUB SUITE","SUITE","TEST CLASS","TEST METHOD"
"Если не передать ни один ингредиент, вернётся код ответа 400 Bad Request","828","Тест получения ошибки, при создании заказа без ингредиентов                 авторизованным пользователем","tests","Wed Aug 13 17:07:27 GMT 2025","passed","Wed Aug 13 17:07:28 GMT 2025","TestRegisterUser","test_create_order","",""
"Проверка: при создании заказа с ингредиентами,             авторизованным пользователем, в ответе содержится id ингредиента","3330","Тест создания заказа c ингредиентами авторизованным пользователем","tests","Wed Aug 13 17:07:22 GMT 2025","passed","Wed Aug 13 17:07:26 GMT 2025","TestRegisterUser","test_create_order","",""
"Если не передать неверный хеш ингредиентов,         вернётся код ответа 500 Internal Server Error","842","Тест получения ошибки, при создании заказа с неверным хешем ингредиентов","tests","Wed Aug 13 17:07:29 GMT 2025","passed","Wed Aug 13 17:07:30 GMT 2025","TestRegisterUser","test_create_order","",""
"Проверка: при создании заказа с авторизацией в теле ответа вернется 'success: true'","3394","Тест возвращения сообщения при успешном создании заказа с авторизацией","tests","Wed Aug 13 17:07:09 GMT 2025","passed","Wed Aug 13 17:07:12 GMT 2025","TestRegisterUser","test_create_order","",""
"Проверка: при создании заказа с авторизацией в теле ответа вернется 200","3363","Тест возвращения кода 200 при успешном создании заказа с авторизацией","tests","Wed Aug 13 17:07:13 GMT 2025","passed","Wed Aug 13 17:07:17 GMT 2025","TestRegisterUser","test_create_order","",""
"Проверка: при создании заказа без авторизаци в теле ответа вернется         'success: false'","2958","Тест создания заказа без авторизации","tests","Wed Aug 13 17:07:18 GMT 2025","failed","Wed Aug 13 17:07:21 GMT 2025","TestRegisterUser","test_create_order","",""
